{
  "provider_id": "wizard.gemini",
  "display_name": "Gemini",
  "budget_group": "tier2_premium",
  "capabilities": [
    "analysis",
    "research",
    "multimodal",
    "long_context"
  ],
  "preferred_for": [
    "OK Diagrammer",
    "OK Researcher"
  ],
  "enabled": true,
  "notes": "Premium multimodal and long-context work."
}
