{
  "provider_id": "wizard.openrouter",
  "display_name": "OpenRouter",
  "budget_group": "tier1_economy",
  "capabilities": [
    "analysis",
    "draft",
    "fallback",
    "routing_gateway"
  ],
  "preferred_for": [
    "OK Librarian",
    "OK Dev Tutor"
  ],
  "enabled": true,
  "notes": "Fallback and economical routing gateway."
}
