{
  "provider_id": "wizard.mistral",
  "display_name": "Mistral",
  "budget_group": "tier0_free",
  "capabilities": [
    "summarize",
    "classify",
    "draft"
  ],
  "preferred_for": [
    "OK Librarian",
    "OK Dev Tutor"
  ],
  "enabled": true,
  "notes": "Low-cost summarisation and classification."
}
