{
  "provider_id": "wizard.anthropic",
  "display_name": "Anthropic",
  "budget_group": "tier2_premium",
  "capabilities": [
    "analysis",
    "draft",
    "research",
    "long_context"
  ],
  "preferred_for": [
    "OK Builder",
    "OK Researcher"
  ],
  "enabled": true,
  "notes": "Premium long-context reasoning and drafting."
}
